{"contractVersion":"0.1.0","jobId":"job_sb1","stage":"storyboard","projectId":"prj_s1","chapterId":"chp_s1","sourceVersionId":"srcv_s1","upstreamConfirmedVersionIds":["cv_ss1","cv_st1"],"status":"succeeded","items":[{"scopeKey":"shot:1","status":"succeeded","value":{"id":"shot_s1","episodeId":"ep_s1","sceneId":"scene_s1","ordinal":1,"visual":"空无一人的监控画面","characters":[],"action":"时间码闪动","speech":"","durationSeconds":5,"shotSize":"wide","cameraAngle":"eye_level","cameraMovement":"static","sound":"门铃三响","emotion":"不安","splitReason":["information_change"],"assetIds":["asset_s1"],"scriptElementIds":["se_s1"],"provenance":[{"type":"source_fragment","sourceVersionId":"srcv_s1","fragmentId":"frag_s1","transformation":"visualized"}]}}]}
